{
  "schema_version": "1.0",
  "stage": "deepdive",
  "sample_sha256": "0000000000000000000000000000000000000000000000000000000000000000",
  "status": "completed",
  "executive_assessment": {
    "verdict": "inconclusive",
    "confidence": 0.5,
    "technical_summary": "Evidence was reconciled, but no payload behavior was confirmed.",
    "highest_value_resolution": null,
    "remaining_decision_point": "Validate the prepared transfer target."
  },
  "finding_reviews": [],
  "contradictions": [],
  "hypotheses": [],
  "root_cause_analysis": [],
  "investigation_targets": [],
  "final_claim_policy": {
    "allowed_claims": [],
    "caveated_claims": [
      "The sample may contain an unresolved loader stage."
    ],
    "prohibited_claims": [
      "Do not claim ransomware behavior."
    ]
  },
  "limitations": [],
  "upstream_inputs": [
    "02-static-pass1.json",
    "05-dynamic.json",
    "06-intel.json"
  ]
}